[
  {
    "abstract": {
      "description": "Condition database includes non-event-related\n      information (Alignment, Calibration, Temperature, etc) and parameters for\n      simulation/reconstruction/analysis software."
    },
    "accelerator": "CERN-LHC",
    "collaboration": {
      "name": "CMS collaboration",
      "recid": "450"
    },
    "collections": [
      "CMS-Condition-Data"
    ],
    "date_created": "2010",
    "date_published": "2016",
    "experiment": "CMS",
    "publisher": "CERN Open Data Portal",
    "recid": "1800",
    "run_period": "Run2010B",
    "title": "Condition data for 2010 CMS collision data",
    "type": {
      "primary": "Environment",
      "secondary": [
        "Condition"
      ]
    }
  }
]
